Sheet:  Heap Sort
D1: Heap sort Timing analysis
A2: r^0 | B2: Array Size | C2: Data f(n) | D2: fitf(n)
A3: =RC[1]^0 -> 1 | B3: 2500 | C3: =R[6]C -> 0.82676000000000005 | D3: =R[6]C[1] -> 1.8064
A4: =RC[1]^0 -> 1 | B4: 42500 | C4: =R[21]C -> 14.228899999999999 | D4: =R[21]C[1] -> 17.8064
A5: =RC[1]^0 -> 1 | B5: 80000 | C5: =R[35]C -> 28.225899999999999 | D5: =R[35]C[1] -> 32.806399999999996
A6: =RC[1]^0 -> 1 | B6: 100000 | C6: =R[42]C -> 36.546900000000001 | D6: =R[42]C[1] -> 40.806399999999996
A8: r^0 | B8: Array Size | C8: Time(s) | D8: f(n)O(r) c1 = 0.000414 | E8: fit(n) | F8: +Delta Above
A9: =RC[1]^0 -> 1 | B9: 2500 | C9: 0.82676000000000005 | D9: =R31C14*RC[-3] +0.000414*RC[-2] -> 1.8413999999999999 | E9: =R31C14*RC[-4] +R32C14*RC[-3] -> 1.8064 | F9: =RC[-2]-RC[-1] -> 3.499999999999992E-2
A10: =RC[1]^0 -> 1 | B10: 5000 | C10: 1.5043599999999999 | D10: =R31C14*RC[-3] +0.000414*RC[-2] -> 2.8763999999999998 | E10: =R31C14*RC[-4] +R32C14*RC[-3] -> 2.8064 | F10: =RC[-2]-RC[-1] -> 6.999999999999984E-2
A11: =RC[1]^0 -> 1 | B11: 7500 | C11: 2.1798600000000001 | D11: =R31C14*RC[-3] +0.000414*RC[-2] -> 3.9114 | E11: =R31C14*RC[-4] +R32C14*RC[-3] -> 3.8064 | F11: =RC[-2]-RC[-1] -> 0.10499999999999998
A12: =RC[1]^0 -> 1 | B12: 10000 | C12: 2.8948 | D12: =R31C14*RC[-3] +0.000414*RC[-2] -> 4.9463999999999997 | E12: =R31C14*RC[-4] +R32C14*RC[-3] -> 4.8064 | F12: =RC[-2]-RC[-1] -> 0.13999999999999968
A13: =RC[1]^0 -> 1 | B13: 12500 | C13: 4.0061 | D13: =R31C14*RC[-3] +0.000414*RC[-2] -> 5.9813999999999998 | E13: =R31C14*RC[-4] +R32C14*RC[-3] -> 5.8064 | F13: =RC[-2]-RC[-1] -> 0.17499999999999982
A14: =RC[1]^0 -> 1 | B14: 15000 | C14: 4.66568 | D14: =R31C14*RC[-3] +0.000414*RC[-2] -> 7.0164 | E14: =R31C14*RC[-4] +R32C14*RC[-3] -> 6.8064 | F14: =RC[-2]-RC[-1] -> 0.20999999999999996
A15: =RC[1]^0 -> 1 | B15: 17500 | C15: 6.0797800000000004 | D15: =R31C14*RC[-3] +0.000414*RC[-2] -> 8.0513999999999992 | E15: =R31C14*RC[-4] +R32C14*RC[-3] -> 7.8064 | F15: =RC[-2]-RC[-1] -> 0.24499999999999922
A16: =RC[1]^0 -> 1 | B16: 20000 | C16: 6.3115199999999998 | D16: =R31C14*RC[-3] +0.000414*RC[-2] -> 9.0863999999999994 | E16: =R31C14*RC[-4] +R32C14*RC[-3] -> 8.8064 | F16: =RC[-2]-RC[-1] -> 0.27999999999999936
A17: =RC[1]^0 -> 1 | B17: 22500 | C17: 7.8962000000000003 | D17: =R31C14*RC[-3] +0.000414*RC[-2] -> 10.1214 | E17: =R31C14*RC[-4] +R32C14*RC[-3] -> 9.8064 | F17: =RC[-2]-RC[-1] -> 0.3149999999999995
A18: =RC[1]^0 -> 1 | B18: 25000 | C18: 8.5510199999999994 | D18: =R31C14*RC[-3] +0.000414*RC[-2] -> 11.1564 | E18: =R31C14*RC[-4] +R32C14*RC[-3] -> 10.8064 | F18: =RC[-2]-RC[-1] -> 0.34999999999999964
A19: =RC[1]^0 -> 1 | B19: 27500 | C19: 9.6037800000000004 | D19: =R31C14*RC[-3] +0.000414*RC[-2] -> 12.1914 | E19: =R31C14*RC[-4] +R32C14*RC[-3] -> 11.8064 | F19: =RC[-2]-RC[-1] -> 0.38499999999999979
A20: =RC[1]^0 -> 1 | B20: 30000 | C20: 10.343299999999999 | D20: =R31C14*RC[-3] +0.000414*RC[-2] -> 13.2264 | E20: =R31C14*RC[-4] +R32C14*RC[-3] -> 12.8064 | F20: =RC[-2]-RC[-1] -> 0.41999999999999993
A21: =RC[1]^0 -> 1 | B21: 32500 | C21: 10.7493 | D21: =R31C14*RC[-3] +0.000414*RC[-2] -> 14.2614 | E21: =R31C14*RC[-4] +R32C14*RC[-3] -> 13.8064 | F21: =RC[-2]-RC[-1] -> 0.45500000000000007
A22: =RC[1]^0 -> 1 | B22: 35000 | C22: 11.8592 | D22: =R31C14*RC[-3] +0.000414*RC[-2] -> 15.296399999999998 | E22: =R31C14*RC[-4] +R32C14*RC[-3] -> 14.8064 | F22: =RC[-2]-RC[-1] -> 0.48999999999999844
A23: =RC[1]^0 -> 1 | B23: 37500 | C23: 12.725099999999999 | D23: =R31C14*RC[-3] +0.000414*RC[-2] -> 16.331399999999999 | E23: =R31C14*RC[-4] +R32C14*RC[-3] -> 15.8064 | F23: =RC[-2]-RC[-1] -> 0.52499999999999858
A24: =RC[1]^0 -> 1 | B24: 40000 | C24: 14.175700000000001 | D24: =R31C14*RC[-3] +0.000414*RC[-2] -> 17.366399999999999 | E24: =R31C14*RC[-4] +R32C14*RC[-3] -> 16.8064 | F24: =RC[-2]-RC[-1] -> 0.55999999999999872
A25: =RC[1]^0 -> 1 | B25: 42500 | C25: 14.228899999999999 | D25: =R31C14*RC[-3] +0.000414*RC[-2] -> 18.401399999999999 | E25: =R31C14*RC[-4] +R32C14*RC[-3] -> 17.8064 | F25: =RC[-2]-RC[-1] -> 0.59499999999999886
A26: =RC[1]^0 -> 1 | B26: 45000 | C26: 15.2592 | D26: =R31C14*RC[-3] +0.000414*RC[-2] -> 19.436399999999999 | E26: =R31C14*RC[-4] +R32C14*RC[-3] -> 18.8064 | F26: =RC[-2]-RC[-1] -> 0.62999999999999901
A27: =RC[1]^0 -> 1 | B27: 47500 | C27: 16.6465 | D27: =R31C14*RC[-3] +0.000414*RC[-2] -> 20.471399999999999 | E27: =R31C14*RC[-4] +R32C14*RC[-3] -> 19.8064 | F27: =RC[-2]-RC[-1] -> 0.66499999999999915 | L27: f(n) =c0*x^0 + c1*x^1
A28: =RC[1]^0 -> 1 | B28: 50000 | C28: 17.846 | D28: =R31C14*RC[-3] +0.000414*RC[-2] -> 21.506399999999999 | E28: =R31C14*RC[-4] +R32C14*RC[-3] -> 20.8064 | F28: =RC[-2]-RC[-1] -> 0.69999999999999929 | L28: f(n) =c0*r^0 + c1*r^1
A29: =RC[1]^0 -> 1 | B29: 52500 | C29: 18.5685 | D29: =R31C14*RC[-3] +0.000414*RC[-2] -> 22.541399999999999 | E29: =R31C14*RC[-4] +R32C14*RC[-3] -> 21.8064 | F29: =RC[-2]-RC[-1] -> 0.73499999999999943
A30: =RC[1]^0 -> 1 | B30: 55000 | C30: 19.525300000000001 | D30: =R31C14*RC[-3] +0.000414*RC[-2] -> 23.5764 | E30: =R31C14*RC[-4] +R32C14*RC[-3] -> 22.8064 | F30: =RC[-2]-RC[-1] -> 0.76999999999999957
A31: =RC[1]^0 -> 1 | B31: 57500 | C31: 19.972100000000001 | D31: =R31C14*RC[-3] +0.000414*RC[-2] -> 24.6114 | E31: =R31C14*RC[-4] +R32C14*RC[-3] -> 23.8064 | F31: =RC[-2]-RC[-1] -> 0.80499999999999972 | M31: c0 = | N31: 0.80640000000000001
A32: =RC[1]^0 -> 1 | B32: 60000 | C32: 20.607700000000001 | D32: =R31C14*RC[-3] +0.000414*RC[-2] -> 25.6464 | E32: =R31C14*RC[-4] +R32C14*RC[-3] -> 24.8064 | F32: =RC[-2]-RC[-1] -> 0.83999999999999986 | M32: c1 = | N32: 4.0000000000000002E-4
A33: =RC[1]^0 -> 1 | B33: 62500 | C33: 21.566500000000001 | D33: =R31C14*RC[-3] +0.000414*RC[-2] -> 26.6814 | E33: =R31C14*RC[-4] +R32C14*RC[-3] -> 25.8064 | F33: =RC[-2]-RC[-1] -> 0.875
A34: =RC[1]^0 -> 1 | B34: 65000 | C34: 22.8628 | D34: =R31C14*RC[-3] +0.000414*RC[-2] -> 27.7164 | E34: =R31C14*RC[-4] +R32C14*RC[-3] -> 26.8064 | F34: =RC[-2]-RC[-1] -> 0.91000000000000014
A35: =RC[1]^0 -> 1 | B35: 67500 | C35: 24.812200000000001 | D35: =R31C14*RC[-3] +0.000414*RC[-2] -> 28.7514 | E35: =R31C14*RC[-4] +R32C14*RC[-3] -> 27.8064 | F35: =RC[-2]-RC[-1] -> 0.94500000000000028
A36: =RC[1]^0 -> 1 | B36: 70000 | C36: 24.771799999999999 | D36: =R31C14*RC[-3] +0.000414*RC[-2] -> 29.786399999999997 | E36: =R31C14*RC[-4] +R32C14*RC[-3] -> 28.8064 | F36: =RC[-2]-RC[-1] -> 0.97999999999999687
A37: =RC[1]^0 -> 1 | B37: 72500 | C37: 25.3446 | D37: =R31C14*RC[-3] +0.000414*RC[-2] -> 30.821399999999997 | E37: =R31C14*RC[-4] +R32C14*RC[-3] -> 29.8064 | F37: =RC[-2]-RC[-1] -> 1.014999999999997
A38: =RC[1]^0 -> 1 | B38: 75000 | C38: 26.7776 | D38: =R31C14*RC[-3] +0.000414*RC[-2] -> 31.856399999999997 | E38: =R31C14*RC[-4] +R32C14*RC[-3] -> 30.8064 | F38: =RC[-2]-RC[-1] -> 1.0499999999999972
A39: =RC[1]^0 -> 1 | B39: 77500 | C39: 27.677499999999998 | D39: =R31C14*RC[-3] +0.000414*RC[-2] -> 32.891400000000004 | E39: =R31C14*RC[-4] +R32C14*RC[-3] -> 31.8064 | F39: =RC[-2]-RC[-1] -> 1.0850000000000044
A40: =RC[1]^0 -> 1 | B40: 80000 | C40: 28.225899999999999 | D40: =R31C14*RC[-3] +0.000414*RC[-2] -> 33.926400000000001 | E40: =R31C14*RC[-4] +R32C14*RC[-3] -> 32.806399999999996 | F40: =RC[-2]-RC[-1] -> 1.1200000000000045
A41: =RC[1]^0 -> 1 | B41: 82500 | C41: 28.6355 | D41: =R31C14*RC[-3] +0.000414*RC[-2] -> 34.961399999999998 | E41: =R31C14*RC[-4] +R32C14*RC[-3] -> 33.806399999999996 | F41: =RC[-2]-RC[-1] -> 1.1550000000000011
A42: =RC[1]^0 -> 1 | B42: 85000 | C42: 29.400600000000001 | D42: =R31C14*RC[-3] +0.000414*RC[-2] -> 35.996399999999994 | E42: =R31C14*RC[-4] +R32C14*RC[-3] -> 34.806399999999996 | F42: =RC[-2]-RC[-1] -> 1.1899999999999977
A43: =RC[1]^0 -> 1 | B43: 87500 | C43: 31.255600000000001 | D43: =R31C14*RC[-3] +0.000414*RC[-2] -> 37.031400000000005 | E43: =R31C14*RC[-4] +R32C14*RC[-3] -> 35.806399999999996 | F43: =RC[-2]-RC[-1] -> 1.2250000000000085
A44: =RC[1]^0 -> 1 | B44: 90000 | C44: 32.094799999999999 | D44: =R31C14*RC[-3] +0.000414*RC[-2] -> 38.066400000000002 | E44: =R31C14*RC[-4] +R32C14*RC[-3] -> 36.806399999999996 | F44: =RC[-2]-RC[-1] -> 1.2600000000000051
A45: =RC[1]^0 -> 1 | B45: 92500 | C45: 32.984000000000002 | D45: =R31C14*RC[-3] +0.000414*RC[-2] -> 39.101399999999998 | E45: =R31C14*RC[-4] +R32C14*RC[-3] -> 37.806399999999996 | F45: =RC[-2]-RC[-1] -> 1.2950000000000017
A46: =RC[1]^0 -> 1 | B46: 95000 | C46: 33.860500000000002 | D46: =R31C14*RC[-3] +0.000414*RC[-2] -> 40.136399999999995 | E46: =R31C14*RC[-4] +R32C14*RC[-3] -> 38.806399999999996 | F46: =RC[-2]-RC[-1] -> 1.3299999999999983
A47: =RC[1]^0 -> 1 | B47: 97500 | C47: 39.816699999999997 | D47: =R31C14*RC[-3] +0.000414*RC[-2] -> 41.171399999999991 | E47: =R31C14*RC[-4] +R32C14*RC[-3] -> 39.806399999999996 | F47: =RC[-2]-RC[-1] -> 1.3649999999999949
A48: =RC[1]^0 -> 1 | B48: 100000 | C48: 36.546900000000001 | D48: =R31C14*RC[-3] +0.000414*RC[-2] -> 42.206400000000002 | E48: =R31C14*RC[-4] +R32C14*RC[-3] -> 40.806399999999996 | F48: =RC[-2]-RC[-1] -> 1.4000000000000057

Sheet:  Quick Sort
D1: quick sort Timing analysis
A2: r^0 | B2: Array Size | C2: Data f(n) | D2: fitf(n)
A3: =RC[1]^0 -> 1 | B3: 2500 | C3: =R[6]C -> 0.36934 | D3: =R[6]C[1] -> 0.14629999999999999
A4: =RC[1]^0 -> 1 | B4: 42500 | C4: =R[21]C -> 6.0356199999999998 | D4: =R[21]C[1] -> 8.1463000000000001
A5: =RC[1]^0 -> 1 | B5: 80000 | C5: =R[35]C -> 12.6289 | D5: =R[35]C[1] -> 15.6463
A6: =RC[1]^0 -> 1 | B6: 100000 | C6: =R[42]C -> 15.952 | D6: =R[42]C[1] -> 19.6463
A8: r^0 | B8: Array Size | C8: Time (s) | D8: f(n)O(r) c1 = 0.000205 | E8: fit(n) | F8: +Delta Above
A9: =RC[1]^0 -> 1 | B9: 2500 | C9: 0.36934 | D9: =R34C15*RC[-3] +0.000205*RC[-2] -> 0.15879999999999994 | E9: =R34C15*RC[-4] +R35C15*RC[-3] -> 0.14629999999999999 | F9: =RC[-2]-RC[-1] -> 1.2499999999999956E-2
A10: =RC[1]^0 -> 1 | B10: 5000 | C10: 0.62912000000000001 | D10: =R34C15*RC[-3] +0.000205*RC[-2] -> 0.6712999999999999 | E10: =R34C15*RC[-4] +R35C15*RC[-3] -> 0.64629999999999999 | F10: =RC[-2]-RC[-1] -> 2.4999999999999911E-2
A11: =RC[1]^0 -> 1 | B11: 7500 | C11: 0.86973999999999996 | D11: =R34C15*RC[-3] +0.000205*RC[-2] -> 1.1837999999999997 | E11: =R34C15*RC[-4] +R35C15*RC[-3] -> 1.1463000000000001 | F11: =RC[-2]-RC[-1] -> 3.7499999999999645E-2
A12: =RC[1]^0 -> 1 | B12: 10000 | C12: 1.2499 | D12: =R34C15*RC[-3] +0.000205*RC[-2] -> 1.6962999999999999 | E12: =R34C15*RC[-4] +R35C15*RC[-3] -> 1.6463000000000001 | F12: =RC[-2]-RC[-1] -> 4.9999999999999822E-2
A13: =RC[1]^0 -> 1 | B13: 12500 | C13: 1.7095 | D13: =R34C15*RC[-3] +0.000205*RC[-2] -> 2.2088000000000001 | E13: =R34C15*RC[-4] +R35C15*RC[-3] -> 2.1463000000000001 | F13: =RC[-2]-RC[-1] -> 6.25E-2
A14: =RC[1]^0 -> 1 | B14: 15000 | C14: 1.9321200000000001 | D14: =R34C15*RC[-3] +0.000205*RC[-2] -> 2.7212999999999998 | E14: =R34C15*RC[-4] +R35C15*RC[-3] -> 2.6463000000000001 | F14: =RC[-2]-RC[-1] -> 7.4999999999999734E-2
A15: =RC[1]^0 -> 1 | B15: 17500 | C15: 2.6120000000000001 | D15: =R34C15*RC[-3] +0.000205*RC[-2] -> 3.2338 | E15: =R34C15*RC[-4] +R35C15*RC[-3] -> 3.1463000000000001 | F15: =RC[-2]-RC[-1] -> 8.7499999999999911E-2
A16: =RC[1]^0 -> 1 | B16: 20000 | C16: 2.8002199999999999 | D16: =R34C15*RC[-3] +0.000205*RC[-2] -> 3.7462999999999997 | E16: =R34C15*RC[-4] +R35C15*RC[-3] -> 3.6463000000000001 | F16: =RC[-2]-RC[-1] -> 9.9999999999999645E-2
A17: =RC[1]^0 -> 1 | B17: 22500 | C17: 3.8087800000000001 | D17: =R34C15*RC[-3] +0.000205*RC[-2] -> 4.2587999999999999 | E17: =R34C15*RC[-4] +R35C15*RC[-3] -> 4.1463000000000001 | F17: =RC[-2]-RC[-1] -> 0.11249999999999982
A18: =RC[1]^0 -> 1 | B18: 25000 | C18: 3.75224 | D18: =R34C15*RC[-3] +0.000205*RC[-2] -> 4.7713000000000001 | E18: =R34C15*RC[-4] +R35C15*RC[-3] -> 4.6463000000000001 | F18: =RC[-2]-RC[-1] -> 0.125
A19: =RC[1]^0 -> 1 | B19: 27500 | C19: 4.0252999999999997 | D19: =R34C15*RC[-3] +0.000205*RC[-2] -> 5.2838000000000003 | E19: =R34C15*RC[-4] +R35C15*RC[-3] -> 5.1463000000000001 | F19: =RC[-2]-RC[-1] -> 0.13750000000000018
A20: =RC[1]^0 -> 1 | B20: 30000 | C20: 4.1951599999999996 | D20: =R34C15*RC[-3] +0.000205*RC[-2] -> 5.7962999999999996 | E20: =R34C15*RC[-4] +R35C15*RC[-3] -> 5.6463000000000001 | F20: =RC[-2]-RC[-1] -> 0.14999999999999947
A21: =RC[1]^0 -> 1 | B21: 32500 | C21: 4.68614 | D21: =R34C15*RC[-3] +0.000205*RC[-2] -> 6.3087999999999997 | E21: =R34C15*RC[-4] +R35C15*RC[-3] -> 6.1463000000000001 | F21: =RC[-2]-RC[-1] -> 0.16249999999999964
A22: =RC[1]^0 -> 1 | B22: 35000 | C22: 4.9676999999999998 | D22: =R34C15*RC[-3] +0.000205*RC[-2] -> 6.8212999999999999 | E22: =R34C15*RC[-4] +R35C15*RC[-3] -> 6.6463000000000001 | F22: =RC[-2]-RC[-1] -> 0.17499999999999982
A23: =RC[1]^0 -> 1 | B23: 37500 | C23: 5.5918000000000001 | D23: =R34C15*RC[-3] +0.000205*RC[-2] -> 7.3338000000000001 | E23: =R34C15*RC[-4] +R35C15*RC[-3] -> 7.1463000000000001 | F23: =RC[-2]-RC[-1] -> 0.1875
A24: =RC[1]^0 -> 1 | B24: 40000 | C24: 5.9798200000000001 | D24: =R34C15*RC[-3] +0.000205*RC[-2] -> 7.8462999999999994 | E24: =R34C15*RC[-4] +R35C15*RC[-3] -> 7.6463000000000001 | F24: =RC[-2]-RC[-1] -> 0.19999999999999929
A25: =RC[1]^0 -> 1 | B25: 42500 | C25: 6.0356199999999998 | D25: =R34C15*RC[-3] +0.000205*RC[-2] -> 8.3588000000000005 | E25: =R34C15*RC[-4] +R35C15*RC[-3] -> 8.1463000000000001 | F25: =RC[-2]-RC[-1] -> 0.21250000000000036
A26: =RC[1]^0 -> 1 | B26: 45000 | C26: 6.5075599999999998 | D26: =R34C15*RC[-3] +0.000205*RC[-2] -> 8.8712999999999997 | E26: =R34C15*RC[-4] +R35C15*RC[-3] -> 8.6463000000000001 | F26: =RC[-2]-RC[-1] -> 0.22499999999999964
A27: =RC[1]^0 -> 1 | B27: 47500 | C27: 7.0292000000000003 | D27: =R34C15*RC[-3] +0.000205*RC[-2] -> 9.383799999999999 | E27: =R34C15*RC[-4] +R35C15*RC[-3] -> 9.1463000000000001 | F27: =RC[-2]-RC[-1] -> 0.23749999999999893
A28: =RC[1]^0 -> 1 | B28: 50000 | C28: 7.7212800000000001 | D28: =R34C15*RC[-3] +0.000205*RC[-2] -> 9.8963000000000001 | E28: =R34C15*RC[-4] +R35C15*RC[-3] -> 9.6463000000000001 | F28: =RC[-2]-RC[-1] -> 0.25
A29: =RC[1]^0 -> 1 | B29: 52500 | C29: 7.8500199999999998 | D29: =R34C15*RC[-3] +0.000205*RC[-2] -> 10.408799999999999 | E29: =R34C15*RC[-4] +R35C15*RC[-3] -> 10.1463 | F29: =RC[-2]-RC[-1] -> 0.26249999999999929
A30: =RC[1]^0 -> 1 | B30: 55000 | C30: 8.3102 | D30: =R34C15*RC[-3] +0.000205*RC[-2] -> 10.9213 | E30: =R34C15*RC[-4] +R35C15*RC[-3] -> 10.6463 | F30: =RC[-2]-RC[-1] -> 0.27500000000000036 | L30: f(n) =c0*x^0 + c1*x^1
A31: =RC[1]^0 -> 1 | B31: 57500 | C31: 8.9133999999999993 | D31: =R34C15*RC[-3] +0.000205*RC[-2] -> 11.4338 | E31: =R34C15*RC[-4] +R35C15*RC[-3] -> 11.1463 | F31: =RC[-2]-RC[-1] -> 0.28749999999999964 | L31: f(n) =c0*r^0 + c1*r^1
A32: =RC[1]^0 -> 1 | B32: 60000 | C32: 8.8902800000000006 | D32: =R34C15*RC[-3] +0.000205*RC[-2] -> 11.946299999999999 | E32: =R34C15*RC[-4] +R35C15*RC[-3] -> 11.6463 | F32: =RC[-2]-RC[-1] -> 0.29999999999999893
A33: =RC[1]^0 -> 1 | B33: 62500 | C33: 9.3656000000000006 | D33: =R34C15*RC[-3] +0.000205*RC[-2] -> 12.4588 | E33: =R34C15*RC[-4] +R35C15*RC[-3] -> 12.1463 | F33: =RC[-2]-RC[-1] -> 0.3125
A34: =RC[1]^0 -> 1 | B34: 65000 | C34: 9.7117199999999997 | D34: =R34C15*RC[-3] +0.000205*RC[-2] -> 12.971299999999999 | E34: =R34C15*RC[-4] +R35C15*RC[-3] -> 12.6463 | F34: =RC[-2]-RC[-1] -> 0.32499999999999929 | N34: c0 = | O34: -0.35370000000000001
A35: =RC[1]^0 -> 1 | B35: 67500 | C35: 10.2744 | D35: =R34C15*RC[-3] +0.000205*RC[-2] -> 13.4838 | E35: =R34C15*RC[-4] +R35C15*RC[-3] -> 13.1463 | F35: =RC[-2]-RC[-1] -> 0.33750000000000036 | N35: c1 = | O35: 2.0000000000000001E-4
A36: =RC[1]^0 -> 1 | B36: 70000 | C36: 10.609400000000001 | D36: =R34C15*RC[-3] +0.000205*RC[-2] -> 13.9963 | E36: =R34C15*RC[-4] +R35C15*RC[-3] -> 13.6463 | F36: =RC[-2]-RC[-1] -> 0.34999999999999964
A37: =RC[1]^0 -> 1 | B37: 72500 | C37: 10.982799999999999 | D37: =R34C15*RC[-3] +0.000205*RC[-2] -> 14.508799999999999 | E37: =R34C15*RC[-4] +R35C15*RC[-3] -> 14.1463 | F37: =RC[-2]-RC[-1] -> 0.36249999999999893
A38: =RC[1]^0 -> 1 | B38: 75000 | C38: 11.8325 | D38: =R34C15*RC[-3] +0.000205*RC[-2] -> 15.0213 | E38: =R34C15*RC[-4] +R35C15*RC[-3] -> 14.6463 | F38: =RC[-2]-RC[-1] -> 0.375
A39: =RC[1]^0 -> 1 | B39: 77500 | C39: 11.5932 | D39: =R34C15*RC[-3] +0.000205*RC[-2] -> 15.533799999999999 | E39: =R34C15*RC[-4] +R35C15*RC[-3] -> 15.1463 | F39: =RC[-2]-RC[-1] -> 0.38749999999999929
A40: =RC[1]^0 -> 1 | B40: 80000 | C40: 12.6289 | D40: =R34C15*RC[-3] +0.000205*RC[-2] -> 16.046299999999999 | E40: =R34C15*RC[-4] +R35C15*RC[-3] -> 15.6463 | F40: =RC[-2]-RC[-1] -> 0.39999999999999858
A41: =RC[1]^0 -> 1 | B41: 82500 | C41: 12.563499999999999 | D41: =R34C15*RC[-3] +0.000205*RC[-2] -> 16.558799999999998 | E41: =R34C15*RC[-4] +R35C15*RC[-3] -> 16.1463 | F41: =RC[-2]-RC[-1] -> 0.41249999999999787
A42: =RC[1]^0 -> 1 | B42: 85000 | C42: 13.071400000000001 | D42: =R34C15*RC[-3] +0.000205*RC[-2] -> 17.071300000000001 | E42: =R34C15*RC[-4] +R35C15*RC[-3] -> 16.6463 | F42: =RC[-2]-RC[-1] -> 0.42500000000000071
A43: =RC[1]^0 -> 1 | B43: 87500 | C43: 13.372999999999999 | D43: =R34C15*RC[-3] +0.000205*RC[-2] -> 17.5838 | E43: =R34C15*RC[-4] +R35C15*RC[-3] -> 17.1463 | F43: =RC[-2]-RC[-1] -> 0.4375
A44: =RC[1]^0 -> 1 | B44: 90000 | C44: 14.158200000000001 | D44: =R34C15*RC[-3] +0.000205*RC[-2] -> 18.096299999999999 | E44: =R34C15*RC[-4] +R35C15*RC[-3] -> 17.6463 | F44: =RC[-2]-RC[-1] -> 0.44999999999999929
A45: =RC[1]^0 -> 1 | B45: 92500 | C45: 14.3393 | D45: =R34C15*RC[-3] +0.000205*RC[-2] -> 18.608799999999999 | E45: =R34C15*RC[-4] +R35C15*RC[-3] -> 18.1463 | F45: =RC[-2]-RC[-1] -> 0.46249999999999858
A46: =RC[1]^0 -> 1 | B46: 95000 | C46: 14.8696 | D46: =R34C15*RC[-3] +0.000205*RC[-2] -> 19.121299999999998 | E46: =R34C15*RC[-4] +R35C15*RC[-3] -> 18.6463 | F46: =RC[-2]-RC[-1] -> 0.47499999999999787
A47: =RC[1]^0 -> 1 | B47: 97500 | C47: 15.7241 | D47: =R34C15*RC[-3] +0.000205*RC[-2] -> 19.633800000000001 | E47: =R34C15*RC[-4] +R35C15*RC[-3] -> 19.1463 | F47: =RC[-2]-RC[-1] -> 0.48750000000000071
A48: =RC[1]^0 -> 1 | B48: 100000 | C48: 15.952 | D48: =R34C15*RC[-3] +0.000205*RC[-2] -> 20.1463 | E48: =R34C15*RC[-4] +R35C15*RC[-3] -> 19.6463 | F48: =RC[-2]-RC[-1] -> 0.5

Sheet:  Shell Sort
D1: Shell sort Timing analysis
A2: r^0 | B2: Array Size | C2: Data f(n) | D2: fitf(n)
A3: =RC[1]^0 -> 1 | B3: 2500 | C3: 0.27344000000000002 | D3: =R[6]C[1] -> -2.5899999999999979E-2
A4: =RC[1]^0 -> 1 | B4: 42500 | C4: 5.6686199999999998 | D4: =R[21]C[1] -> 3.9741
A5: =RC[1]^0 -> 1 | B5: 80000 | C5: 11.4893 | D5: =R[35]C[1] -> 7.7241
A6: =RC[1]^0 -> 1 | B6: 100000 | C6: 14.561500000000001 | D6: =R[42]C[1] -> 9.7241
A8: r^0 | B8: Array Size | C8: Time (s) | D8: f(n)O(r) c1 = 0.000107 | E8: fit(n) | F8: +Delta Above
A9: =RC[1]^0 -> 1 | B9: 2500 | C9: 0.27344000000000002 | D9: =R34C13*RC[-3] +0.000107*RC[-2] -> -8.3999999999999631E-3 | E9: =R34C13*RC[-4] +R35C13*RC[-3] -> -2.5899999999999979E-2 | F9: =RC[-2]-RC[-1] -> 1.7500000000000016E-2
A10: =RC[1]^0 -> 1 | B10: 5000 | C10: 0.49340000000000001 | D10: =R34C13*RC[-3] +0.000107*RC[-2] -> 0.25910000000000005 | E10: =R34C13*RC[-4] +R35C13*RC[-3] -> 0.22410000000000002 | F10: =RC[-2]-RC[-1] -> 3.5000000000000031E-2
A11: =RC[1]^0 -> 1 | B11: 7500 | C11: 0.73155999999999999 | D11: =R34C13*RC[-3] +0.000107*RC[-2] -> 0.52659999999999996 | E11: =R34C13*RC[-4] +R35C13*RC[-3] -> 0.47410000000000002 | F11: =RC[-2]-RC[-1] -> 5.2499999999999936E-2
A12: =RC[1]^0 -> 1 | B12: 10000 | C12: 0.99853999999999998 | D12: =R34C13*RC[-3] +0.000107*RC[-2] -> 0.79410000000000003 | E12: =R34C13*RC[-4] +R35C13*RC[-3] -> 0.72409999999999997 | F12: =RC[-2]-RC[-1] -> 7.0000000000000062E-2
A13: =RC[1]^0 -> 1 | B13: 12500 | C13: 1.34026 | D13: =R34C13*RC[-3] +0.000107*RC[-2] -> 1.0615999999999999 | E13: =R34C13*RC[-4] +R35C13*RC[-3] -> 0.97409999999999997 | F13: =RC[-2]-RC[-1] -> 8.7499999999999911E-2
A14: =RC[1]^0 -> 1 | B14: 15000 | C14: 1.5624800000000001 | D14: =R34C13*RC[-3] +0.000107*RC[-2] -> 1.3290999999999999 | E14: =R34C13*RC[-4] +R35C13*RC[-3] -> 1.2241 | F14: =RC[-2]-RC[-1] -> 0.10499999999999998
A15: =RC[1]^0 -> 1 | B15: 17500 | C15: 2.02786 | D15: =R34C13*RC[-3] +0.000107*RC[-2] -> 1.5966 | E15: =R34C13*RC[-4] +R35C13*RC[-3] -> 1.4741 | F15: =RC[-2]-RC[-1] -> 0.12250000000000005
A16: =RC[1]^0 -> 1 | B16: 20000 | C16: 2.5155599999999998 | D16: =R34C13*RC[-3] +0.000107*RC[-2] -> 1.8641000000000001 | E16: =R34C13*RC[-4] +R35C13*RC[-3] -> 1.7241 | F16: =RC[-2]-RC[-1] -> 0.14000000000000012
A17: =RC[1]^0 -> 1 | B17: 22500 | C17: 3.12534 | D17: =R34C13*RC[-3] +0.000107*RC[-2] -> 2.1315999999999997 | E17: =R34C13*RC[-4] +R35C13*RC[-3] -> 1.9741 | F17: =RC[-2]-RC[-1] -> 0.15749999999999975
A18: =RC[1]^0 -> 1 | B18: 25000 | C18: 2.9602200000000001 | D18: =R34C13*RC[-3] +0.000107*RC[-2] -> 2.3990999999999998 | E18: =R34C13*RC[-4] +R35C13*RC[-3] -> 2.2241 | F18: =RC[-2]-RC[-1] -> 0.17499999999999982
A19: =RC[1]^0 -> 1 | B19: 27500 | C19: 3.2155 | D19: =R34C13*RC[-3] +0.000107*RC[-2] -> 2.6665999999999999 | E19: =R34C13*RC[-4] +R35C13*RC[-3] -> 2.4741 | F19: =RC[-2]-RC[-1] -> 0.19249999999999989
A20: =RC[1]^0 -> 1 | B20: 30000 | C20: 3.5322 | D20: =R34C13*RC[-3] +0.000107*RC[-2] -> 2.9340999999999999 | E20: =R34C13*RC[-4] +R35C13*RC[-3] -> 2.7241 | F20: =RC[-2]-RC[-1] -> 0.20999999999999996
A21: =RC[1]^0 -> 1 | B21: 32500 | C21: 3.9123800000000002 | D21: =R34C13*RC[-3] +0.000107*RC[-2] -> 3.2016 | E21: =R34C13*RC[-4] +R35C13*RC[-3] -> 2.9741 | F21: =RC[-2]-RC[-1] -> 0.22750000000000004
A22: =RC[1]^0 -> 1 | B22: 35000 | C22: 4.4050399999999996 | D22: =R34C13*RC[-3] +0.000107*RC[-2] -> 3.4691000000000001 | E22: =R34C13*RC[-4] +R35C13*RC[-3] -> 3.2241 | F22: =RC[-2]-RC[-1] -> 0.24500000000000011
A23: =RC[1]^0 -> 1 | B23: 37500 | C23: 4.7167599999999998 | D23: =R34C13*RC[-3] +0.000107*RC[-2] -> 3.7366000000000001 | E23: =R34C13*RC[-4] +R35C13*RC[-3] -> 3.4741 | F23: =RC[-2]-RC[-1] -> 0.26250000000000018
A24: =RC[1]^0 -> 1 | B24: 40000 | C24: 5.1759000000000004 | D24: =R34C13*RC[-3] +0.000107*RC[-2] -> 4.0041000000000002 | E24: =R34C13*RC[-4] +R35C13*RC[-3] -> 3.7241 | F24: =RC[-2]-RC[-1] -> 0.28000000000000025
A25: =RC[1]^0 -> 1 | B25: 42500 | C25: 5.6686199999999998 | D25: =R34C13*RC[-3] +0.000107*RC[-2] -> 4.2716000000000003 | E25: =R34C13*RC[-4] +R35C13*RC[-3] -> 3.9741 | F25: =RC[-2]-RC[-1] -> 0.29750000000000032
A26: =RC[1]^0 -> 1 | B26: 45000 | C26: 5.6620600000000003 | D26: =R34C13*RC[-3] +0.000107*RC[-2] -> 4.5390999999999995 | E26: =R34C13*RC[-4] +R35C13*RC[-3] -> 4.2241 | F26: =RC[-2]-RC[-1] -> 0.3149999999999995
A27: =RC[1]^0 -> 1 | B27: 47500 | C27: 6.1170200000000001 | D27: =R34C13*RC[-3] +0.000107*RC[-2] -> 4.8065999999999995 | E27: =R34C13*RC[-4] +R35C13*RC[-3] -> 4.4741 | F27: =RC[-2]-RC[-1] -> 0.33249999999999957
A28: =RC[1]^0 -> 1 | B28: 50000 | C28: 6.7081400000000002 | D28: =R34C13*RC[-3] +0.000107*RC[-2] -> 5.0740999999999996 | E28: =R34C13*RC[-4] +R35C13*RC[-3] -> 4.7241 | F28: =RC[-2]-RC[-1] -> 0.34999999999999964
A29: =RC[1]^0 -> 1 | B29: 52500 | C29: 6.5621200000000002 | D29: =R34C13*RC[-3] +0.000107*RC[-2] -> 5.3415999999999997 | E29: =R34C13*RC[-4] +R35C13*RC[-3] -> 4.9741 | F29: =RC[-2]-RC[-1] -> 0.36749999999999972
A30: =RC[1]^0 -> 1 | B30: 55000 | C30: 7.2600199999999999 | D30: =R34C13*RC[-3] +0.000107*RC[-2] -> 5.6090999999999998 | E30: =R34C13*RC[-4] +R35C13*RC[-3] -> 5.2241 | F30: =RC[-2]-RC[-1] -> 0.38499999999999979 | K30: f(n) =c0*x^0 + c1*x^1
A31: =RC[1]^0 -> 1 | B31: 57500 | C31: 7.9041600000000001 | D31: =R34C13*RC[-3] +0.000107*RC[-2] -> 5.8765999999999998 | E31: =R34C13*RC[-4] +R35C13*RC[-3] -> 5.4741 | F31: =RC[-2]-RC[-1] -> 0.40249999999999986 | K31: f(n) =c0*r^0 + c1*r^1
A32: =RC[1]^0 -> 1 | B32: 60000 | C32: 7.8883799999999997 | D32: =R34C13*RC[-3] +0.000107*RC[-2] -> 6.1440999999999999 | E32: =R34C13*RC[-4] +R35C13*RC[-3] -> 5.7241 | F32: =RC[-2]-RC[-1] -> 0.41999999999999993
A33: =RC[1]^0 -> 1 | B33: 62500 | C33: 8.3561200000000007 | D33: =R34C13*RC[-3] +0.000107*RC[-2] -> 6.4116 | E33: =R34C13*RC[-4] +R35C13*RC[-3] -> 5.9741 | F33: =RC[-2]-RC[-1] -> 0.4375
A34: =RC[1]^0 -> 1 | B34: 65000 | C34: 8.8764000000000003 | D34: =R34C13*RC[-3] +0.000107*RC[-2] -> 6.6791 | E34: =R34C13*RC[-4] +R35C13*RC[-3] -> 6.2241 | F34: =RC[-2]-RC[-1] -> 0.45500000000000007 | L34: c0 = | M34: -0.27589999999999998
A35: =RC[1]^0 -> 1 | B35: 67500 | C35: 9.0516400000000008 | D35: =R34C13*RC[-3] +0.000107*RC[-2] -> 6.9466000000000001 | E35: =R34C13*RC[-4] +R35C13*RC[-3] -> 6.4741 | F35: =RC[-2]-RC[-1] -> 0.47250000000000014 | L35: c1 = | M35: 1E-4
A36: =RC[1]^0 -> 1 | B36: 70000 | C36: 9.2519399999999994 | D36: =R34C13*RC[-3] +0.000107*RC[-2] -> 7.2141000000000002 | E36: =R34C13*RC[-4] +R35C13*RC[-3] -> 6.7241 | F36: =RC[-2]-RC[-1] -> 0.49000000000000021
A37: =RC[1]^0 -> 1 | B37: 72500 | C37: 9.52196 | D37: =R34C13*RC[-3] +0.000107*RC[-2] -> 7.4816000000000003 | E37: =R34C13*RC[-4] +R35C13*RC[-3] -> 6.9741 | F37: =RC[-2]-RC[-1] -> 0.50750000000000028
A38: =RC[1]^0 -> 1 | B38: 75000 | C38: 10.009499999999999 | D38: =R34C13*RC[-3] +0.000107*RC[-2] -> 7.7491000000000003 | E38: =R34C13*RC[-4] +R35C13*RC[-3] -> 7.2241 | F38: =RC[-2]-RC[-1] -> 0.52500000000000036
A39: =RC[1]^0 -> 1 | B39: 77500 | C39: 10.433400000000001 | D39: =R34C13*RC[-3] +0.000107*RC[-2] -> 8.0166000000000004 | E39: =R34C13*RC[-4] +R35C13*RC[-3] -> 7.4741 | F39: =RC[-2]-RC[-1] -> 0.54250000000000043
A40: =RC[1]^0 -> 1 | B40: 80000 | C40: 11.4893 | D40: =R34C13*RC[-3] +0.000107*RC[-2] -> 8.2841000000000005 | E40: =R34C13*RC[-4] +R35C13*RC[-3] -> 7.7241 | F40: =RC[-2]-RC[-1] -> 0.5600000000000005
A41: =RC[1]^0 -> 1 | B41: 82500 | C41: 11.6898 | D41: =R34C13*RC[-3] +0.000107*RC[-2] -> 8.5516000000000005 | E41: =R34C13*RC[-4] +R35C13*RC[-3] -> 7.9741 | F41: =RC[-2]-RC[-1] -> 0.57750000000000057
A42: =RC[1]^0 -> 1 | B42: 85000 | C42: 12.5771 | D42: =R34C13*RC[-3] +0.000107*RC[-2] -> 8.8191000000000006 | E42: =R34C13*RC[-4] +R35C13*RC[-3] -> 8.2241 | F42: =RC[-2]-RC[-1] -> 0.59500000000000064
A43: =RC[1]^0 -> 1 | B43: 87500 | C43: 11.797800000000001 | D43: =R34C13*RC[-3] +0.000107*RC[-2] -> 9.0866000000000007 | E43: =R34C13*RC[-4] +R35C13*RC[-3] -> 8.4741 | F43: =RC[-2]-RC[-1] -> 0.61250000000000071
A44: =RC[1]^0 -> 1 | B44: 90000 | C44: 12.527799999999999 | D44: =R34C13*RC[-3] +0.000107*RC[-2] -> 9.354099999999999 | E44: =R34C13*RC[-4] +R35C13*RC[-3] -> 8.7241 | F44: =RC[-2]-RC[-1] -> 0.62999999999999901
A45: =RC[1]^0 -> 1 | B45: 92500 | C45: 12.6608 | D45: =R34C13*RC[-3] +0.000107*RC[-2] -> 9.621599999999999 | E45: =R34C13*RC[-4] +R35C13*RC[-3] -> 8.9741 | F45: =RC[-2]-RC[-1] -> 0.64749999999999908
A46: =RC[1]^0 -> 1 | B46: 95000 | C46: 13.7492 | D46: =R34C13*RC[-3] +0.000107*RC[-2] -> 9.8890999999999991 | E46: =R34C13*RC[-4] +R35C13*RC[-3] -> 9.2241 | F46: =RC[-2]-RC[-1] -> 0.66499999999999915
A47: =RC[1]^0 -> 1 | B47: 97500 | C47: 13.9102 | D47: =R34C13*RC[-3] +0.000107*RC[-2] -> 10.156599999999999 | E47: =R34C13*RC[-4] +R35C13*RC[-3] -> 9.4741 | F47: =RC[-2]-RC[-1] -> 0.68249999999999922
A48: =RC[1]^0 -> 1 | B48: 100000 | C48: 14.561500000000001 | D48: =R34C13*RC[-3] +0.000107*RC[-2] -> 10.424099999999999 | E48: =R34C13*RC[-4] +R35C13*RC[-3] -> 9.7241 | F48: =RC[-2]-RC[-1] -> 0.69999999999999929

Sheet:  Merge Sort
D1: Merge sort Timing analysis
A2: r^0 | B2: Array Size | C2: Data f(n) | D2: fitf(n)
A3: =RC[1]^0 -> 1 | B3: 2500 | C3: =R[6]C -> 0.52363999999999999 | D3: =R[6]C[1] -> 0.68589999999999995
A4: =RC[1]^0 -> 1 | B4: 42500 | C4: =R[21]C -> 7.3428599999999999 | D4: =R[21]C[1] -> 8.6859000000000002
A5: =RC[1]^0 -> 1 | B5: 80000 | C5: =R[35]C -> 13.5318 | D5: =R[35]C[1] -> 16.1859
A6: =RC[1]^0 -> 1 | B6: 100000 | C6: =R[42]C -> 18.528600000000001 | D6: =R[42]C[1] -> 20.1859
A8: r^0 | B8: Array Size | C8: Time(s) | D8: f(n)O(r) c1 = 0.000203 | E8: fit(n) | F8: +Delta Above
A9: =RC[1]^0 -> 1 | B9: 2500 | C9: 0.52363999999999999 | D9: =R31C14*RC[-3] +0.000203*RC[-2] -> 0.50749999999999995 | E9: =R32C12*RC[-4] +R33C12*RC[-3] -> 0.68589999999999995 | F9: =RC[-2]-RC[-1] -> -0.1784
A10: =RC[1]^0 -> 1 | B10: 5000 | C10: 0.83121999999999996 | D10: =R31C14*RC[-3] +0.000203*RC[-2] -> 1.0149999999999999 | E10: =R32C12*RC[-4] +R33C12*RC[-3] -> 1.1859 | F10: =RC[-2]-RC[-1] -> -0.17090000000000005
A11: =RC[1]^0 -> 1 | B11: 7500 | C11: 1.1274999999999999 | D11: =R31C14*RC[-3] +0.000203*RC[-2] -> 1.5225 | E11: =R32C12*RC[-4] +R33C12*RC[-3] -> 1.6859 | F11: =RC[-2]-RC[-1] -> -0.16339999999999999
A12: =RC[1]^0 -> 1 | B12: 10000 | C12: 1.5411600000000001 | D12: =R31C14*RC[-3] +0.000203*RC[-2] -> 2.0299999999999998 | E12: =R32C12*RC[-4] +R33C12*RC[-3] -> 2.1859000000000002 | F12: =RC[-2]-RC[-1] -> -0.15590000000000037
A13: =RC[1]^0 -> 1 | B13: 12500 | C13: 2.04236 | D13: =R31C14*RC[-3] +0.000203*RC[-2] -> 2.5375000000000001 | E13: =R32C12*RC[-4] +R33C12*RC[-3] -> 2.6859000000000002 | F13: =RC[-2]-RC[-1] -> -0.14840000000000009
A14: =RC[1]^0 -> 1 | B14: 15000 | C14: 2.4433799999999999 | D14: =R31C14*RC[-3] +0.000203*RC[-2] -> 3.0449999999999999 | E14: =R32C12*RC[-4] +R33C12*RC[-3] -> 3.1859000000000002 | F14: =RC[-2]-RC[-1] -> -0.14090000000000025
A15: =RC[1]^0 -> 1 | B15: 17500 | C15: 2.9904600000000001 | D15: =R31C14*RC[-3] +0.000203*RC[-2] -> 3.5525000000000002 | E15: =R32C12*RC[-4] +R33C12*RC[-3] -> 3.6859000000000002 | F15: =RC[-2]-RC[-1] -> -0.13339999999999996
A16: =RC[1]^0 -> 1 | B16: 20000 | C16: 3.7547199999999998 | D16: =R31C14*RC[-3] +0.000203*RC[-2] -> 4.0599999999999996 | E16: =R32C12*RC[-4] +R33C12*RC[-3] -> 4.1859000000000002 | F16: =RC[-2]-RC[-1] -> -0.12590000000000057
A17: =RC[1]^0 -> 1 | B17: 22500 | C17: 4.4102800000000002 | D17: =R31C14*RC[-3] +0.000203*RC[-2] -> 4.5674999999999999 | E17: =R32C12*RC[-4] +R33C12*RC[-3] -> 4.6859000000000002 | F17: =RC[-2]-RC[-1] -> -0.11840000000000028
A18: =RC[1]^0 -> 1 | B18: 25000 | C18: 4.2169400000000001 | D18: =R31C14*RC[-3] +0.000203*RC[-2] -> 5.0750000000000002 | E18: =R32C12*RC[-4] +R33C12*RC[-3] -> 5.1859000000000002 | F18: =RC[-2]-RC[-1] -> -0.1109
A19: =RC[1]^0 -> 1 | B19: 27500 | C19: 5.08744 | D19: =R31C14*RC[-3] +0.000203*RC[-2] -> 5.5825000000000005 | E19: =R32C12*RC[-4] +R33C12*RC[-3] -> 5.6859000000000002 | F19: =RC[-2]-RC[-1] -> -0.10339999999999971
A20: =RC[1]^0 -> 1 | B20: 30000 | C20: 5.0999999999999996 | D20: =R31C14*RC[-3] +0.000203*RC[-2] -> 6.09 | E20: =R32C12*RC[-4] +R33C12*RC[-3] -> 6.1859000000000002 | F20: =RC[-2]-RC[-1] -> -9.5900000000000318E-2
A21: =RC[1]^0 -> 1 | B21: 32500 | C21: 5.4335000000000004 | D21: =R31C14*RC[-3] +0.000203*RC[-2] -> 6.5975000000000001 | E21: =R32C12*RC[-4] +R33C12*RC[-3] -> 6.6859000000000002 | F21: =RC[-2]-RC[-1] -> -8.8400000000000034E-2
A22: =RC[1]^0 -> 1 | B22: 35000 | C22: 5.8913599999999997 | D22: =R31C14*RC[-3] +0.000203*RC[-2] -> 7.1050000000000004 | E22: =R32C12*RC[-4] +R33C12*RC[-3] -> 7.1859000000000002 | F22: =RC[-2]-RC[-1] -> -8.089999999999975E-2
A23: =RC[1]^0 -> 1 | B23: 37500 | C23: 6.4322999999999997 | D23: =R31C14*RC[-3] +0.000203*RC[-2] -> 7.6124999999999998 | E23: =R32C12*RC[-4] +R33C12*RC[-3] -> 7.6859000000000002 | F23: =RC[-2]-RC[-1] -> -7.3400000000000354E-2
A24: =RC[1]^0 -> 1 | B24: 40000 | C24: 6.5848599999999999 | D24: =R31C14*RC[-3] +0.000203*RC[-2] -> 8.1199999999999992 | E24: =R32C12*RC[-4] +R33C12*RC[-3] -> 8.1859000000000002 | F24: =RC[-2]-RC[-1] -> -6.5900000000000958E-2
A25: =RC[1]^0 -> 1 | B25: 42500 | C25: 7.3428599999999999 | D25: =R31C14*RC[-3] +0.000203*RC[-2] -> 8.6274999999999995 | E25: =R32C12*RC[-4] +R33C12*RC[-3] -> 8.6859000000000002 | F25: =RC[-2]-RC[-1] -> -5.8400000000000674E-2
A26: =RC[1]^0 -> 1 | B26: 45000 | C26: 7.3681599999999996 | D26: =R31C14*RC[-3] +0.000203*RC[-2] -> 9.1349999999999998 | E26: =R32C12*RC[-4] +R33C12*RC[-3] -> 9.1859000000000002 | F26: =RC[-2]-RC[-1] -> -5.0900000000000389E-2
A27: =RC[1]^0 -> 1 | B27: 47500 | C27: 8.1107399999999998 | D27: =R31C14*RC[-3] +0.000203*RC[-2] -> 9.6425000000000001 | E27: =R32C12*RC[-4] +R33C12*RC[-3] -> 9.6859000000000002 | F27: =RC[-2]-RC[-1] -> -4.3400000000000105E-2
A28: =RC[1]^0 -> 1 | B28: 50000 | C28: 9.0780999999999992 | D28: =R31C14*RC[-3] +0.000203*RC[-2] -> 10.15 | E28: =R32C12*RC[-4] +R33C12*RC[-3] -> 10.1859 | F28: =RC[-2]-RC[-1] -> -3.5899999999999821E-2 | J28: f(n) =c0*x^0 + c1*x^1
A29: =RC[1]^0 -> 1 | B29: 52500 | C29: 9.2792600000000007 | D29: =R31C14*RC[-3] +0.000203*RC[-2] -> 10.657500000000001 | E29: =R32C12*RC[-4] +R33C12*RC[-3] -> 10.6859 | F29: =RC[-2]-RC[-1] -> -2.8399999999999537E-2 | J29: f(n) =c0*r^0 + c1*r^1
A30: =RC[1]^0 -> 1 | B30: 55000 | C30: 9.61 | D30: =R31C14*RC[-3] +0.000203*RC[-2] -> 11.165000000000001 | E30: =R32C12*RC[-4] +R33C12*RC[-3] -> 11.1859 | F30: =RC[-2]-RC[-1] -> -2.0899999999999253E-2
A31: =RC[1]^0 -> 1 | B31: 57500 | C31: 9.6179400000000008 | D31: =R31C14*RC[-3] +0.000203*RC[-2] -> 11.672499999999999 | E31: =R32C12*RC[-4] +R33C12*RC[-3] -> 11.6859 | F31: =RC[-2]-RC[-1] -> -1.3400000000000745E-2
A32: =RC[1]^0 -> 1 | B32: 60000 | C32: 9.84084 | D32: =R31C14*RC[-3] +0.000203*RC[-2] -> 12.18 | E32: =R32C12*RC[-4] +R33C12*RC[-3] -> 12.1859 | F32: =RC[-2]-RC[-1] -> -5.9000000000004604E-3 | K32: c0 = | L32: 0.18590000000000001
A33: =RC[1]^0 -> 1 | B33: 62500 | C33: 10.6876 | D33: =R31C14*RC[-3] +0.000203*RC[-2] -> 12.6875 | E33: =R32C12*RC[-4] +R33C12*RC[-3] -> 12.6859 | F33: =RC[-2]-RC[-1] -> 1.5999999999998238E-3 | K33: c1 = | L33: 2.0000000000000001E-4
A34: =RC[1]^0 -> 1 | B34: 65000 | C34: 11.3268 | D34: =R31C14*RC[-3] +0.000203*RC[-2] -> 13.195 | E34: =R32C12*RC[-4] +R33C12*RC[-3] -> 13.1859 | F34: =RC[-2]-RC[-1] -> 9.100000000000108E-3
A35: =RC[1]^0 -> 1 | B35: 67500 | C35: 11.4872 | D35: =R31C14*RC[-3] +0.000203*RC[-2] -> 13.702500000000001 | E35: =R32C12*RC[-4] +R33C12*RC[-3] -> 13.6859 | F35: =RC[-2]-RC[-1] -> 1.6600000000000392E-2
A36: =RC[1]^0 -> 1 | B36: 70000 | C36: 11.8248 | D36: =R31C14*RC[-3] +0.000203*RC[-2] -> 14.21 | E36: =R32C12*RC[-4] +R33C12*RC[-3] -> 14.1859 | F36: =RC[-2]-RC[-1] -> 2.4100000000000676E-2
A37: =RC[1]^0 -> 1 | B37: 72500 | C37: 12.3369 | D37: =R31C14*RC[-3] +0.000203*RC[-2] -> 14.717499999999999 | E37: =R32C12*RC[-4] +R33C12*RC[-3] -> 14.6859 | F37: =RC[-2]-RC[-1] -> 3.1599999999999184E-2
A38: =RC[1]^0 -> 1 | B38: 75000 | C38: 12.5794 | D38: =R31C14*RC[-3] +0.000203*RC[-2] -> 15.225 | E38: =R32C12*RC[-4] +R33C12*RC[-3] -> 15.1859 | F38: =RC[-2]-RC[-1] -> 3.9099999999999469E-2
A39: =RC[1]^0 -> 1 | B39: 77500 | C39: 13.262700000000001 | D39: =R31C14*RC[-3] +0.000203*RC[-2] -> 15.7325 | E39: =R32C12*RC[-4] +R33C12*RC[-3] -> 15.6859 | F39: =RC[-2]-RC[-1] -> 4.6599999999999753E-2
A40: =RC[1]^0 -> 1 | B40: 80000 | C40: 13.5318 | D40: =R31C14*RC[-3] +0.000203*RC[-2] -> 16.239999999999998 | E40: =R32C12*RC[-4] +R33C12*RC[-3] -> 16.1859 | F40: =RC[-2]-RC[-1] -> 5.4099999999998261E-2
A41: =RC[1]^0 -> 1 | B41: 82500 | C41: 13.746499999999999 | D41: =R31C14*RC[-3] +0.000203*RC[-2] -> 16.747499999999999 | E41: =R32C12*RC[-4] +R33C12*RC[-3] -> 16.6859 | F41: =RC[-2]-RC[-1] -> 6.1599999999998545E-2
A42: =RC[1]^0 -> 1 | B42: 85000 | C42: 14.313000000000001 | D42: =R31C14*RC[-3] +0.000203*RC[-2] -> 17.254999999999999 | E42: =R32C12*RC[-4] +R33C12*RC[-3] -> 17.1859 | F42: =RC[-2]-RC[-1] -> 6.9099999999998829E-2
A43: =RC[1]^0 -> 1 | B43: 87500 | C43: 14.94 | D43: =R31C14*RC[-3] +0.000203*RC[-2] -> 17.762499999999999 | E43: =R32C12*RC[-4] +R33C12*RC[-3] -> 17.6859 | F43: =RC[-2]-RC[-1] -> 7.6599999999999113E-2
A44: =RC[1]^0 -> 1 | B44: 90000 | C44: 15.366 | D44: =R31C14*RC[-3] +0.000203*RC[-2] -> 18.27 | E44: =R32C12*RC[-4] +R33C12*RC[-3] -> 18.1859 | F44: =RC[-2]-RC[-1] -> 8.4099999999999397E-2
A45: =RC[1]^0 -> 1 | B45: 92500 | C45: 16.1007 | D45: =R31C14*RC[-3] +0.000203*RC[-2] -> 18.7775 | E45: =R32C12*RC[-4] +R33C12*RC[-3] -> 18.6859 | F45: =RC[-2]-RC[-1] -> 9.1599999999999682E-2
A46: =RC[1]^0 -> 1 | B46: 95000 | C46: 16.921099999999999 | D46: =R31C14*RC[-3] +0.000203*RC[-2] -> 19.285 | E46: =R32C12*RC[-4] +R33C12*RC[-3] -> 19.1859 | F46: =RC[-2]-RC[-1] -> 9.9099999999999966E-2
A47: =RC[1]^0 -> 1 | B47: 97500 | C47: 16.908000000000001 | D47: =R31C14*RC[-3] +0.000203*RC[-2] -> 19.7925 | E47: =R32C12*RC[-4] +R33C12*RC[-3] -> 19.6859 | F47: =RC[-2]-RC[-1] -> 0.10660000000000025
A48: =RC[1]^0 -> 1 | B48: 100000 | C48: 18.528600000000001 | D48: =R31C14*RC[-3] +0.000203*RC[-2] -> 20.3 | E48: =R32C12*RC[-4] +R33C12*RC[-3] -> 20.1859 | F48: =RC[-2]-RC[-1] -> 0.11410000000000053